category,start page,last page,domain,anchor text
https://meta.stackexchange.com/questions/311737/lets-hold-language-in-comments-to-the-same-standard-as-posts?cb=1,3,997,stackoverflow.com,Let's hold language in comments to the same standard as posts
https://meta.stackoverflow.com/questions/348131/should-we-burninate-the-ibm-tag?cb=1,3,997,stackoverflow.com,Should we burninate the [ibm] tag?
https://meta.stackoverflow.com/questions/370095/merging-the-excel-vba-into-vba-speak-now-or-forever-hold-your-peace?cb=1,3,997,stackoverflow.com,Merging the excel-vba into vba - speak now, or forever hold your peace
https://meta.stackoverflow.com/questions/370095/merging-the-excel-vba-into-vba-speak-now-or-forever-hold-your-peace?cb=1,3,997,stackoverflow.com,Merging the excel-vba into vba - speak now, or forever hold your peace
https://stackoverflow.com/questions/39022183/in-javascript-how-can-i-ignore-blank-lines-while-uploading-a-csv-file,3,997,stackoverflow.com,address bar
